{
  "id": "CTX-MIS-DEMO-01",
  "mission_id": "MIS-DEMO-01",
  "profile": "technical",
  "budget": {
    "target_tokens": 1800,
    "hard_tokens": 3200,
    "estimated_tokens": 418,
    "tier": "normal_mission"
  },
  "authority": [
    "MWB-PD-2026-09-15-r3"
  ],
  "objective": "Repair mobile Review interaction while preserving accepted desktop behavior.",
  "snapshot_id": null,
  "delta_id": null,
  "items": [
    {
      "ref": "DEC-014",
      "level": "L2",
      "critical": true,
      "text": "Responsive interaction transforms rather than hides capability; mobile is focused single-pane work."
    },
    {
      "ref": "SCN-RSP-04",
      "level": "L2",
      "critical": true,
      "text": "Primary review actions remain reachable at mobile width."
    },
    {
      "ref": "OBJ-REVIEW",
      "level": "L1",
      "critical": true,
      "text": "Human review queue/detail and decision boundary."
    },
    {
      "ref": "FILE-review",
      "level": "L1",
      "critical": false,
      "text": "src/review/*"
    }
  ],
  "expansion_handles": [
    "DEC-014",
    "SCN-RSP-04",
    "OBJ-REVIEW"
  ],
  "omitted": [],
  "escalation_reason": null,
  "metrics": {
    "duplicate_count": 1,
    "duplicate_ratio": 0.16666666666666666
  }
}
